,review_score,review_comment
0,4.2,"['저도 예약하기전 후기들을 많이 찾아보고 갔는데도 약간의 불안감이 있었는데 여행 후기 결론은 대 만 족!.일단 수영장은 약품 냄새가 많이 나긴 했지만 그만큼 위생에 신경써주신다는 생각이 들었고 물온도 아주 좋았습니다! 특히 저희는 7살 아이둘이 함께 있어서 아이들이 춥지 않을까 걱정했는데 온도가 아주 적절했구요!.특히 저희 신랑은 탈수기가 아주 좋았다고 하네요.애들 옷 말리려면 아주ㅠㅠ 큰일이라 너무 큰 서비스를 받았습니다 ..강아지들을 위한 시설도 아주 깔끔하게 마련되어 있어서 너무 편하게 놀다왔네요! 애들 식기부터 배변패드,쿠션, 강아지 타올까지! 아주 섬세하게 준비해놓으셨어요 ..비가 와서 잔디밭에서 뛰놀지 못한게 가장 아쉽습니다ㅠ.내년에도 다시 이용할 예정입니다!더보기', '험난한시기에 방문결정주셔서 감사합니다 비가와서 아쉬운점많으셨죠 베스트후기에당첨되셔서 가평레일바이크이용권 2매 보내드리께요 내년에 또뵐수있었으면 좋겠어요', '일단 산속이라 굉장히 습해요 ㅋ 그리고 추워요ㅠ.입실할때 사장님께서 실내온도 24도에 맞춰놓았다고 하셨는데.수영을 하고오니 너무 추워서 에어컨을 껐어요 ㅋ.그뒤로 에어컨은 안켰어요 밤에 이불도 잘 덮고 잤어요ㅋ.산속이라 확실히 쌀쌀하더라구요 ㅋ.밤엔 펜션 조명이 너무 예뻤어요 ~..그리고 공용수영장은 생각보다 너무 깨끗했어요..날아다니는 벌레들이 알아서 입수하는걸 사장님께서 막을 순 없으니.당연히 벌레는 떠다녀요...ㅋ.이건 정말 어쩔수 없어요 근데 개털은 안보였어요 ㅋ.좀 아쉬운 건 물이 미온수까진 아니더라구요ㅠ.30분정도 놀다보니 추워서 나왔어요 ㅋ..그리고 펜션마당에 인공잔디랑 울타리를 잘 해놓으셔서.댕댕이가 뛰어놀기 너무 좋았어요 ~.저희 아이는 다른 친구들한테 입질을 좀 해서ㅠ.걱정이 돼서 풀어놓지 못하고 항상 목줄을 했는데.다른 댕댕이들은 줄 없이 잘 뛰어놀았어요 ㅋㅋ..그리고 숯불!! 와 ~ 저는 고깃집 불판쓰는 펜션은 처음이었어요 ㅋㅋ.고기 진짜 너무 맛있게 구워먹었어요 ㅋ.옥수수랑 고구마도 가져가서 숯에 구워먹었는데.정말 ㅠㅠ 감동이었어요 ㅠㅠ JMT ㅠㅠ.그리고 바베큐장도 각 실마다 따로 공간이 돼있어서.다른 친구들과 소란 떠는거 없이 조용히 저녁을 먹을 수 있었습니다...너무 만족스러운 여행이었습니다 ^^더보기', '안녕하세요  ^^우선 동반펜션을 이용해주셔서 감사합니다  여름에도 산속이라 아침저녁으로 시원하답니다~~귀여운 강아지랑 즐거운시간 가지셨다니 저희도 즐겁네요  벌레는 늘 신경쓰고있는데도 어쩔수없는 부분이있음을 이해해주시니 더 감사드립니다  앞으로도 불편하신점 참고하여 개선하도록 노력하겠습니다 .감사합니다 .강아지랑 행복하세요 ^^더보기', '조리기구 다 있고 청결도, 숙소, 시설 다 만족합니다👍.애견용 스파, 드라이룸, 샴푸 린스 다 있어서 굳이 안 들고오셔도 될 것 같네요. 수영장도 따뜻하고 넓었어요 !.애견용 튜브랑 구명조끼 다 있어서 편하고 재밌게 놀다갑니다...주인아주머니도 굉장히 친절하셨고 지인분들에게 추천해드리고 싶은 그런 숙소였어요 !! 밤에는 별도 잘 보이고 운치좋은 곳이에요ㅠ 또 갈 예정입니다 :)더보기', '안녕하세요 ^^우선 동반펜션을 이용해주셔서 감사드립니다 .이용하시는데 불편함은 없으셨는지요 즐거운시간에 저희와 함께  해주셔서 감사합니다 .귀여운 강아지 와의 재방문을 기대하며 ~~늘 행복하시길 바랄께요^^', '친절하시고 수영장 등 청결 관리가 잘돼 편안하게 잘 쉬었습니다', '시설은 살짝 올드한 느낌이 있었지만 객실내부는 청결하고 침구도 깔끔했습니다. 수영장도 미온수로 잘 이용했고 강아지 구명조끼, 강아지 샤워시설도 잘 마련되어있습니다. 복층인데 안전하게 펜스가 다 설치되어있어 계단 오르고 내릴때 불편함 없었습니다. 특히 고기구워먹는데 바베큐 불이 은은해서 고기가 타지 않고 잘 구워진 펜션은 이곳이 처음이었습니다. 사장님도 너무 친절하시고 너무 만족스러웠습니다. 주말동안 잘 쉬다갑니다^^', '사장님 너무 친절하시고 시설도 너무 깨끗하고 좋았습니다 단점은 수영장 물이 좀 따뜻했으면 더 좋았을거 같아요 나머지는 너무 좋았습니다~', '안녕하세요 고객님~.먼저 저희 펜션을 이용하시고, 이렇게 소중한 후기에 행복한 말을 담아주셔서 감사합니다:).저희 펜션을 이용해주시는 모든 고객님들께 친절함으로 응대하려 노력하는 부분을 알아주셔서 감사드리며, 추후 재방문 기회가 있으시다면 보다 더 나은 서비스를 제공할 수 있도록 더욱 더 노력하겠습니다^^.감사합니다~!더보기', '시설은 사용감이 좀 있지만 청결하게 과.관리가 잘 되었고, 샤워용품도 싸구려 안쓰고 식기류가 이케아 제품으로 펜션스럽지 않고 고급졌어요. 침구류 상태도 깨끗해서 좋았네요.복층 숙소 계단이 조금 가팔라서 강아지 안고 오르내리며 조금 무서웠지만 장점이 더 많아서 재방문 의사 있어요. 산속 깊이 있어 밤에 날벌레가 많았던게 젤 단점이었어요.', '안녕하세요..저희 펜션을 이용해주셔서 감사드리며, 항상 최고의 펜션이 될 수 있도록 더욱 더 노력하겠습니다..행복한 시간 보내주셨고 소중한 후기까지 작성해주셔서 저희 펜션 또한 뿌듯하고 행복한 시간이였습니다..감사합니다^^', '시설이 너무 잘 관리되어서 좋았어요..관리자도 너무 착하시고...담에 다시 방문할께요.', '안녕하세요..저희 펜션을 이용해주셔서 감사드리며, 항상 최고의 펜션이 될 수 있도록 더욱 더 노력하겠습니다..행복한 시간 보내주셨고 소중한 후기까지 작성해주셔서 저희 펜션 또한 뿌듯하고 행복한 시간이였습니다..감사합니다^^', '예약하기전 후기를 많이 보고 평가도가 그렇게 나쁘지 .않은것 같아 괜찮다 싶어 예약후 방문결과.너무 실망했습니다.사장님의 친절도도 모르겠구.기존2명 추가인원2명 가능한 객실로.성인3 아동1 반려견1.이렇게 예약 했습니다.일단 금액대비 퀄리티가 너무 낮고 사진대비 너무 좁은데다 .객실에서 야외바베큐장 및 스파, 풀빌라 이용시 계단을.오르락 내리락 너무 불편했으며.반려견이 소형견이면 오르지도 못할 정도로 계단이 높으며 개인 풀장 +스파 실내, 외 바베큐장 및.객실내부 또한 청소가 제대로 이루어지는지.눈살을 찌뿌릴 정도로 더러웠으며.객실 내부중 욕실 바닥에 여성용 머리카락은 길게.군데군데 있었고.클린용 테이프(일명 돌돌이) 에도 전 고객이 사용한 흔적 먼지 머리카락도 그대로 있고 스파 바닥엔 벌레죽은것, 먼지등 풀빌라엔 곰팡이 미끄러움등.1박이니 하루만 참자하며 놀다 왔지만.추천도 해주고 싶지도 않구 .다녀본것중 다시는 가구 싶지 않은곳 1위가 될거 같네요더보기', '안녕하세요 고객님.우선 저희 펜션을 이용하시면서 불편함을 느끼신 부분에 대해 먼저 사과드립니다..객실 정비 및 세세하게 확인하여 고객님께 만족감을 드렸어야 하는데 그러하지 못한 점이 많았던 것 같습니다..이용하시면서 불편하셨던 부분은 사과의 말씀드리며, 고객님께서 말씀주신 것들 하나 하나 귀담아 들어 더욱 보완하고 노력하여 좋은 서비스를 제공할 수 있도록 하겠습니다..감사합니다.더보기', '시설은 노후합니다. 화장실 배수가 안되어서 물바다. 수영장도 물이 깨끗한 편은 아닙니다. 바베큐 숱과 그릴 비용이 4만원으로 비쌉니다. 산속이라 주변 접근성은 안좋으나 경치는 좋습니다. 물은 판매중이고 기본 제공 물은 없습니다. 그냥 정말 반려견과 갈때 없을때 갈수 있는 정도의 수준. 적극 추천을 어렵습니다.', '안녕하세요 고객님.먼저 저희 펜션을 이용해주셔서 감사하다는 말씀드립니다..세세하게 챙기지 못한 부분으로 불편함을 드린 것 같습니다..해당 부분은 유념하여 좀 더 신경쓰도록 하겠습니다..이용하시면서 불편하셨던 부분은 사과의 말씀드리며, 소중한 후기 감사드립니다.더보기', '사진과 좀 다른 듯 했지만 그럭저럭 잘 지내고 왔습니다', '안녕하세요 고객님~.먼저 저희 펜션을 이용해주셔서 감사하다는 말씀 먼저 드립니다..항상 고객님께 100%만족감을 드리고 싶은 마음은 앞서나, 그러지 못함에 따라 아쉬움에 먼저 따릅니다..고객님들 한분 한분 얘기를 귀담아 들어 최대의 서비스가 제공될 수 있도록 더욱 노력하겠습니다..감사합니다.더보기', '진짜 좋았어요 강아지들도 좋아하고 수영장도 넓고 좋았어요!', '안녕하세요 고객님!.방문해주시고 재밌게 보내고 가셨다니 저희가 오히려 너무 감사드립니다..앞으로도 만족할 수 있도록 더욱 더 노력하겠습니다..감사합니다 :)', '생각이상으로 너무 좋아서 다음에 또 방문예정입니다!', '안녕하세요..저희 펜션을 이용해주셔서 감사드리며, 항상 최고의 펜션이 될 수 있도록 더욱 더 노력하겠습니다..행복한 시간 보내주셨고 소중한 후기까지 작성해주셔서 저희 펜션 또한 뿌듯하고 행복한 시간이였습니다..감사합니다^^', '가성비 갑이라고 봅니다.  사장님도 친절하세요..선선한 날씨에  1층에서  바베큐 잘해먹었어요', '안녕하세요 고객님~.먼저 저희 펜션을 이용하시고, 이렇게 소중한 후기와 사진도 담아주셔서 감사합니다:).저희 펜션을 이용해주시는 모든 고객님들께 친절함으로 응대하려 노력하는 부분을 알아주셔서 감사드리며, 추후 재방문 기회가 있으시다면 보다 더 나은 서비스를 제공할 수 있도록 더욱 더 노력하겠습니다^^.감사합니다~!더보기', '애견펜션인데 사람이 더신나게놀고와써요', '안녕하세요 고객님!.방문해주시고 재밌게 보내고 가셨다니 저희가 오히려 너무 감사드립니다..앞으로도 만족할 수 있도록 더욱 더 노력하겠습니다..감사합니다 :)', '마중냥이 쫄랑이가 있어요. 숙소에 무단침입 하려는 아주 웃기고 귀엽고 착하고 멋지고 잘생긴 고양이에요. 강없찐 주제에 호기롭게 반려견 동반펜션을 예약한 저희도 행복하게 털동물을 쓰다듬고 왔어요.후기 수정 중에 사진이 날아가서 못올려서 너무 아쉬울 정도에요. 동반펜션답게 기본용품들이 다 갖춰져있어서 강아지와 함께왔다면 참 좋았을 것 같아요. 마당문도 걸어잠글 수 있고 방묘창?? 안전물도 있어요. 기본풀장이 있어서 수영도 할 수 있었어요. 마당이 참 예쁘고 장난감도 있어요. 개인 바베큐장을 실내/실외 중 고를 수 있고 실내로 골라 벌레없고 춥지않게 이용했습니다! 숙소가 깔끔하고 시설들이 잘 준비되어 있고 돌돌이도 있어요! 다른 펜션에 비해 깊이 위치해있지만 마트픽업으로 이동이 불편하진 않았어요. 주인분도 친절하셨습니다! 넘넘 재밌게 놀다가요더보기', '안녕하세요 고객님!.방문해주시고 재밌게 보내고 가셨다니 저희가 오히려 너무 감사드립니다..앞으로도 만족할 수 있도록 더욱 더 노력하겠습니다..감사합니다 :)', '친절하시고..  편의성은 좋은데..  청결상태가 곳곳 너무 안좋았네요.. 쓰레기가 남아있거나..  세면대 날파리들이 죽어있고... 등등..  기대이하여서.. 같은 금액이면 재방문은 안할듯 합니다..', '안녕하세요 고객님.우선 저희 펜션을 이용하시면서 불편함을 느끼신 부분에 대해 먼저 사과드립니다..객실 정비 및 세세하게 확인하여 고객님께 만족감을 드렸어야 하는데 그러하지 못한 점이 많았던 것 같습니다..고객님께서 말씀주신 것들 하나 하나 귀담아 들어 더욱 보완하고 노력하여 좋은 서비스를 제공할 수 있도록 하겠습니다..감사합니다.더보기', '펜션이 조용하고 쫄랑이 귀여워요', '안녕하세요..저희 펜션을 이용해주셔서 감사드리며, 항상 최고의 펜션이 될 수 있도록 더욱 더 노력하겠습니다..행복한 시간 보내주셨고 소중한 후기까지 작성해주셔서 저희펜션 또한 뿌듯하고 행복한 시간이였습니다..감사합니다^^', '너무편하게잘쉬다가왔습니다.', '안녕하세요 고객님!.방문해주시고 재밌게 보내고 가셨다니 저희가 오히려 너무 감사드립니다..앞으로도 만족할 수 있도록 더욱 더 노력하겠습니다..감사합니다 :)', '시설 생각보다 깔끔해요', '안녕하세요..항상 청결을 우선으로 생각하며 운영하고 있는데, 이 부분을 알아봐주셔서 너무 감사드립니다..여기에 만족하지 않고 더욱더 서비스를 제공할 수 있도록 노력하겠습니다..감사합니다:)']"
1,3.9,"['여자사장님 손님한테 짜증좀내지마세요 기분좋게놀러가서 입실부터 퇴실까지 자꾸짜증내시고 인상찌뿌리시고 저희도 같이짜증못내는거 아니고 기분좋은날이니까 참는거에요', '좋아도 싫어도 애지간해서는 귀찮아서 후기 안쓰는 사람이 후기를 달아봅니다. .결론 : .1. 간혹 보이는 치명적인 후기가 있는데는 이유가 있음. 풀장 위생상태 최악 (비위 좋은 사람인데 구역질함).2. 객실 안내 잘 읽고가시길 (추가요금 있음).3. 현재 6월 말 객실 내 벌래 많음,, (너무 놀라서 처음으로 숙소 사진을 찍어봄).4. 사장님 아닌 직원분이 숙소 관리를 하셔서 컨플레인을 말해도 해결이 쉽지않음 (시스템 문제인듯,, 사람좋게 생기신 직원분은 매우 친절하시지만 존재 이유를 모르겠음)..장점: 개별 풀장 물놀이가 재밋음, 튜브도 있음,매우 습기차서 사우나 하는것 같음, 수건이 여섯장이나 있음, 직원분이 인상이 매우좋고 컴플레인에 도움을 주실 수 없었지만,,그래도 친절하심..단점: 에어컨에서 물 새서 바닥에 물기 흥건 (좋은게 좋은거라고 생각하는 커플이라 그냥 감전만 안되면되징ㅋ 하면서 전기 빼놓음), 방이 거의 곤충도감, 컨플레인이 있으면 야놀자에 전화해야하는 이상한 프로세스를 가짐 물론 야놀자도 해결 못해줌 왜냐면 얘네는 중계업체자나여,,, 풀장 샤워실쪽에 슬리퍼로 닦일정도에 물때를 보유하고있음, 물에 이상한거 떠다님 ㅠ힝..평소 남한테 싫은말 못하는 꽃사슴같은 남자친구가 프로세스 운운하시면서 사장님 컨펌 전에는 아무것도 할 수 없다며 숙소에 있는 벌레 보시면서 감탄하시는 직원분 행동에 지금 심각하신거 직접 보셨으면 감탄만 하지마시고 해결책좀 달라고 박력있게 말하는 모습 보고 조금은 믿음직스럽다고 생각하게됨. 방바꿔서 잤고 이미 뭐 어쩔 수 없으니 정신승리 해보자면 좋은거 배웠고 또 남자친구의 의외의 모습을 발견해서 오히려좋아~~~!가보자고~~~! 물론 이쪽으로는 다신 안올꺼같음더보기', '정말좋아요', '더러운건 둘째치고 걍 오바인곳입니다.기분 좋게 여행하시려면 무조건 다른곳 가세요!.찝찝 체험 하시고 싶으신 분들께 추천합니다ㅎㅎ..ㅎ.숙박비가 사실 저렴한편도 아닌데, 필수 온수비 오만원을 현장 결제해야하는거 꼼꼼히 확인하셔야할듯 합니다.연박이면 무조건 추가금 두배이고, 히팅기 비용이라하시면서 물은 차갑고 더럽고.... 걍 3일동안 갈아주지도 않더라구요.주차장에 당당히 뜰채를 전시해두셨던데 한달에 한번은 갈고 계시는지........방에는 거미줄 천지에.. 거미만 3마리 잡음ㅠ.스파에 물을 받았다니 하얀 각질과 무슨 콩나물.. 둥둥.. 토할뻔했네요....사장님과 얘기하고 싶다니까 본인은 관리인이고 사장 번호는 모른다(?) 야놀자에 전화해라........(?).이 방에 오는 사람마다 컴플레인이네 하면서 손님한테 투덜대지말고 왜.. 오는사람마다 화가나는지 생각을 해보세요ㅋㅋㅋㅋㅋ 짐다싸서 왔으니 취소도 안될거고 니네는 걍 자야한다는 뻔뻔함....👏👏더보기', '너무 친절하시구 바베큐장은 살짝 작은느낌 있는데 대만족 입니다', '애기들과 좋은 추억 남길 수 있어 너무 좋았던 곳 ! 👍', '아늑하고 깨끗하고 만족스러웠습니다!.다음에 또 방문할게용:)', 'ㅂㄷㅂ싣ㅂ잉', '저 처럼 사진과 후기에 속아 보고 가시는 분들이 계실까봐 후기 씁니다 솔직히 여기는 진짜 숙박업 하면 안 될 거 같습니다! 후기는 어떤 앱을 사용 하셨음 이렇게 실물과 다르게 찍고 편집 하셨을지 그 노력에 한 번 놀라고 도착 하고 외부는 깨끗했지만 내부는 정말 더러웠던 점에 또 한 번 놀라고 이 팬션을 1박 2일로 약 50이라는 돈을 주고 간 거에 놀라서 총 3번이나 놀랐습니다 일단 외부는 깨끗하고 누가봐도 가고싶게 만드는 외부 였지만 내부는 충격적입니다! 곰팡이와 벌레 벽지 찢김 등등이 있었고 물은 깨끗했지만 몇개의 벌레가 물에 동동 떠다니는걸 보니 내가 팬션 선택을 너무너무너무 잘 했구나 생각을 하게 만들었습니다ㅎㅎ;; 사진은 뽀샤시 해서 정말 좋아보였지만 사진을 보시다시피..충격 그 자체 입니다^_^ 난 돈이 많고 돈을 쓸 때가 없으니 버리고 싶다! 하시는 분들은 여기 팬션을 정말 추천 드립니당 ㅎ ㅎ더보기', '깨끗한 수영장 물, 침구 등 좋았습니다! 패브릭 소품은 쓸수 있는 정도의 청결도는 아니었어요~ 수영장물은 입실부터 퇴실까지 온도유지 해주셨고 수영장 창이 폴딩도어라 전망도 좋고 행복했네요~ 주인분도 친절하셨어요! 잘 놀다 왔습니다!', '살면서 가봤던 모텔, 호텔, 리조트, 펜션 통틀어서 가장 더러웠습니다..일단 밖에서 보는 시설은 깔끔해보였고, 사진도 깔끔해보여 예약했는데 안에는 최악입니다...후기도 나쁜 것도 많았지만 좋은것도있어서 믿고가봤는데 ... 절대 재방문은 없을 것 같습니다...바닥은 한번도 안닦으셨는지 휴지에 물묻혀서 닦아보니 새까맣게 묻어나오더라구요.. 그리고 제일 최악인건 2만원내고 쓰는 전기그릴이였습니다..더러운 벽면을 보고 먹는 구조도 맘에 안즐었고 기본적인 식탁, 의자 청소도 안하셨는지 정말.. 최악이였습니다ㅠㅠ .주인분들 친절하시구 좋지만 그걸로는 커버될 수 없는 느낌입니다ㅠ 숙소 청결에 더 신경쓰셔야할 것 같습니다…더보기', 'ㄱㅅ급잏ㅂ', '깔끔하고 좋아요', '솔직히 깨끗한지는 모르겠음 .. 사진이랑 쫌다름', '와 진짜 너무 실망스러워요!!!.분명 아기있다고 수영장 깨끗하냐 확인전화까지 했었는데,, 관리인이 바껴서 걱정안해도 된다고 하셨는데,, 물상태 너무 별로에요. 스파는 들어가고 싶지도 않았어요,, 물에 뭐가 이렇게 많이 떠다니는건지,,후,, 미온수 5만원이나 받으시는데,, 관리 심각하네요ㅠ.그리고 쇼파도 좀 바꾸셔야할꺼같아여ㅠ진짜 가죽 다 갈라지고 벗겨져서 앉을수도 없어요,, 침구류는 펼쳤더니 먼지가 다닥다닥 붙어있고,, 진짜 사진과는 너무너무 다른 상태였어요ㅠ 후,, 주말에 더 비싼돈주고 갔으면 더 화날뻔했어요. 진짜 비추합니다더보기', '펜션이 주인이 바뀌어서 그런지 주인분한테 문의드렸을때 모르는 것도 있었고 펜션 안에 고장난게 좀 많았어요 문고리 등등 조금 아쉽긴했지만 그냥 잘 놀고 왔습니다!', '올리고 싶은 사진이 엄청많고 동영상도 있는데 야놀자는 올릴수있는 사진용량이 생각보다 작아서 친절하게 편집해서 올립니다~ .풀빌라에서 이끼냄새를 맡을줄이야 ㅋㅋㅋㅋ너무 신선한 경험이네요 .방안에서는 삼겹살 기름쩐내가 나고 수영장에서는 이끼+하수구 냄새로 가득하네요.그리고 스파는 꺼지지않아 밤새 제트스파 소리가 귓가에 맴도네요 자장가인줄 .장점은 24시간 미온수 수영장이네요 하지만 사진에서 보이는것처럼 곰팡이와 이물질들이 둥둥어다니는 수영장에 들어가지못하겠어요더보기', '음 당일 통보로 지역과 숙소 변경 당했는데 처음에 기분이 안좋았지만 다른 숙소 가보니 오히려 좋긴 좋았습니다 다음에 가평 숙소를 이용해보고싶네요ㅠ', '온수가 나오지 않는 것만 빼면 괜찮은 편인듯합니다ㅎㅎ', '사장님 너무너무 친절하시구요!!!! 가평펜션 예약하면 실망많이하는데 여기는너무좋아요   깨끗하구 좋아요 몇번더갈것같아요! 사장님 짱']"
2,4.0,"['네이버후기가  안좋아서 걱정했었는데 괜히걱정햇었던거같아요ㅎㅎ가자마자 주인아주머니가 원래알던이모처럼 완전반갑게 맞이해주시고 강아지도 엄청이뻐하시는거같더라구여.애견운동장도 애들뛰어놀기에 되게좋았구요 청소상태안좋다고 되있던데 경쟁업체들이신가 애견펜션이 이렇게 개냄새도안나고 깨끗할수가있나 했어요ㅋㅋㅋ경포대도 차로 오분이면가고 너무좋았습니다!', '안녕하세요? 편안히 즐겁게 계시다 가셨다니 제가 더 흐뭇합니다. 애견인들이 쾌적하게 편안히 다녀가실수 있도록 앞으로도 더욱 신경쓸께요. 감사합니다.', '5명이 퇴근후에 방문해서.저녁 11시반에 체크인 했는데 .친절하게 체크인 도와주시고,.신경 많이 써주신거같았습니다..경포대 접근성이 좋구요ㅎㅎ..덕분에 5명이 즐거운 시간 보냈습니다더보기', '장시간을 달려 펜션에 도착했는데 남자친구와 둘다 입을 다물지못했어요 우선 저희를 웃으면서 반겨주시는 사장님~ 안내도 너무 친절하게 잘해주시고 편하게 대해주셨어요 내부를 보는순간 우와..🤩 너무 깔끔하고 집처럼 포근한느낌 이여서 또한번 놀라고 바베큐도 개인별로 이용할수있어서 너무너무 편하고 좋았어요 1박을 머물고 돌아가는데 아쉬움뿐이였어요 다음에 또 놀러오면 또 다시 머물고 갈꺼에요 감사합니당😆', '만족스러웠어요~!', '좋았던곳.하지만 강아지랑 함께 뛰놀수 있을거라고 생각했는데...그러기엔 좁고 작은 잔디', '매우 만족한 여행이였습니다..숯불만 조금더 주셨으면 좋겠어요', '시설도 너무좋고 깔끔했어요 사장님도 친절하시구 강아지도 무서워하지않구 이뻐해주셔서 도착하자마자 기분좋았네여 ㅎㅎ', '소중한 후기 감사드려요 기분좋게 지내다 가셔서 제가 더 흐뭇합니다. 또 놀러 오세요.', '전반적으로 다 괜찮어씀', '좋았습니다~', '늦은시간 체크인도 잘 받아주시구 숙소 바로앞에 공용 잔디밭이 작아도 웰시코기인 우리 강아지가 놀기에도 실외배변하기에도 좋았습니당', '완전 좋았어여~', '너무 편하게 잘 쉬 었다 갑니다 근데 수건이 하나여서 좀 그랬어요 그리고 방에 거미줄 있구요 그이외에는 괜찬았습니다', '잘이용했습니다', '주인 아주머니께서 굉장히 친절하십니다!! 하지만 2박은 하지 마세요..', '그냥 저냥 하루 잘만했습니다 다만 한것도 없는데 1층에서 조금만 조심히걸어달라고 올라오셨어요 방음이 취약한듯 해요', '사장님 친절하시고 방도 넓고 좋았어요!!.다만 역시 반려견들과 함께 이용하는 곳이라 그런지 ㅜ 반려견들 마킹 냄새가 스믈스믈 올라오더라구요 ㅜ .마킹한 냄새만 빼면 정말 만족했던 곳!', '넘 편하게 좋은 추억 만들고  갑니다~~^^.재방문 의사 100%입니다!', '강릉가서 항상가는곳입니다 . 항상 깔끔하게 방이 좋았는데.이번엔 좀 . ㅜㅜ.', '그냥 잠만 자고 나올정도입니다', '사장님 너무 친절하시고! 룸도 정말 깨끗했어요!']"
