title,저자,발행기관,발행연도,핵심어
교통약자의 이동편의 향상을 위한 국내외 정책사례,김태호(Tae-Ho Kim),대한토목학회,2012,
배리어프리 환경 조성을 위한 정책 및 환경요소의 중요도 평가,김종진,대한교통학회,2012,
도로입체화시설의 정책방향연구,김숙희,대한교통학회,2012,
야외휴양시설 유니버설 디자인 적용방안,이주희,숲과 문화 연구회,2012,
교통약자를 위한 경로안내도 디자인,이호숭(Lee Ho Soong),한국디자인학회,2012,"['경로안내도', '관광지 접근성', '교통약자', '판독성', '지도디자인', 'route guidance map', 'tour accessibility', 'mobilityhandicapped', 'legibility', 'cartography']"
행동유도성(affordance)을 기반으로 한 부산 도심 버스정류장(bus bay)의 고찰,"권태정(Kwon, Tae Jung)",한국도시설계학회,2012,"['도심 버스정류장', '행동유도성', '계층화분석', 'Urban Bus Bay', 'Affordance', 'AHP(Analytical Hierarchy Process)']"
통계문헌을 활용한 교통약자의 유형별 정의 및 전망,김태호,대한교통학회,2012,
영구임대아파트 외부 커뮤니티공간의 교통약자 접근성 연구                      = A Study on Accessibility of Impeditive mover to Outdoor Community Space in Apartment Complexes for Permanent rental,박선아(Sun A Park),한국생활과학회(KOREAN LIVING SCIENCE ASSOCIATION),2012,
스마트 카의 통합 안전 제어기술                      = Integrated Vehicle Safety Control Systems for Smart Cars,이경수,에스케이텔레콤 (주),2012,"['Smart vehicle', 'Integrated vehicle safety control systems', 'Active safety', 'Driver assistance', '스마트자동차', '통합안전제어시스템', '능동안전', '운전자 지원']"
교통약자를 위한 소형버스의 탑승구 디자인,이정현(Jung-Hyun Lee),한국생산제조학회,2012,"['The mobility handicapped(교통약자)', 'Small buses(소형버스)', 'Wheelchair(휠체어)', 'Ramp(램프)']"
장애인 · 노인 · 임산부 등의 편의증진보장에 관한 법률 제정사,차성안(車城安),서울대 사회보장법연구회,2012,"['장애인·노인·임산부 등의 편의증진보장에 관한 법률', '편의시설', '편의증진', '접근권', '이동권', '입법과정', '교통약자의 이동편의증진법', 'the Act on Accommodation Promotion of the Disabled', 'the Elderly and Pregnant Women', 'Access Enhancement Facility', 'Access Right', 'Mobility right', 'Act making process', 'the Mobility Enhancement for the Mobility Impaired Act.']"
지킴이 서비스를 위한 교통약자 인식장치 적정배치및 위험도 평가에 관한 연구                      = A Study on Optimum Allocation and Risk Assessment of Recognition Devices Intendedfor the Mobility Handicapped in Terms of the Guardian Services,한웅구,한국ITS학회,2012,"['The mobility handicapped', 'Recognition devices', 'Comprehensive risk']"
2010 교통문화지수(TCI) 모형검증 및 함의,"차용진(Cha, Yong-jin)",경기연구원,2012,"['교통문화지수', '신뢰도', '타당도', '확인적 요인분석', '고차요인분석', 'transport culture index', 'reliability', 'validity', 'confirmatory factor analysis', 'higher order factor analysis']"
교통약자에 대한 여객서비스 개선을 위한 도우미 시스템 개발                      = Development of Public Transportation Support System for Improved Passenger Service,송용수,대한전기학회,2012,
교통약자를 위한 자동차 기술                      = 고령 운전자를 중심으로,"손준우(Son, Joonwoo)",한국자동차공학회,2012,
국회 소속 민간근로자 호봉제 도입 방안 연구,김유선,한국노동사회연구소,2012,
도시철도 환승역사의 상하이동시설에 대한 이용자의 편의 고찰,황보현,대한교통학회,2011,
"부산, 약자친화디자인 본격 도입이 필요",김영하,부산연구원,2011,
교통약자의 유형별 이동편의시설 만족도 분석에 관한 연구   :                         경산시를 사례로                                = Study on Transportation Handicapped’s Satisfaction Level of Transportation Facilities - A Case Study of Gyeongsan City,윤대식(Yun,한국지역사회학회,2011,"['Transportion Handicapped', 'Transportion Facilities', 'Satisfaction Level', 'Gyeongsan City']"
AHP분석을 통한 Barrier Free 인증 기준 개선 방안에 관한 연구,신강원,대한교통학회,2011,
공정한 국토ㆍ지역발전을 위한 정책과제,문정호,한국지방정부학회(The Korean Association for Local Government Studies),2011,"['공정사회', '국토ㆍ지역정책', '갈등관리', '손실보상']"
주관적 운전부하 수준과 PG기법 적용효과의 관계                      = The Relationship between Subjective Driving Workload and Effects of PG Technology,오주석,대한교통학회,2011,"['PG기법', '주관적 운전부하', '주행속도', '도로이용자 만족도', '운전시뮬레이터', 'PG technology', 'Subjective driving workload', 'Driving speed', ""Road user's satisfaction"", 'Driving simulator']"
일반인과 교통약자의 도시철도 역사의 보행시설 이용에 관한 비교분석 (Comparative Analysis of the Use of a Pedestrian Facility for Non-Mobility Handicapped and Mobility Handicapped in Urban Rail Station),황보현(Hyun Hwang-Bo),한국철도학회,2011,
공정한 국토·지역발전을 위한 정책과제,문정호,한국지방정부학회,2011,"['공정사회', '국토·지역정책', '갈등관리', '손실보상']"
승합차의 램프 디자인과 제작을 위한 이종재료의 접합,이정현(Jung-Hyun Lee),한국생산제조학회,2011,"['Disabled and elderly(교통약자)', 'Wheelchair(휠체어)', 'Ramp(램프)', 'Nd:YAG Laser(Nd:YAG레이저)', 'Dissimilar welding(이종 용접)']"
한국의 공익개념 연구   :                         공익관련 법률내용 분석을 중심으로                                = A Study on the Concept of Public Interest in Korea: Focus on the Content Analysis of Law Related to Public Interest,이계만(李啓滿),한국정책과학학회,2011,"['공익', '공익개념', '공익과정론', 'Public Interest', 'Concept of Public Interest', 'Processional Theory of Public Interest']"
대중교통 문제점에 따른 교통선진화 방안 제시에 관한 연구,고동봉,대한교통학회,2011,
보행교통량에 따른 회전교차로 설치 타당성 분석,문주백,대한교통학회,2011,
시각장애인용 지능형 보행안내 시스템 설계,"이중엽(Lee, Joong-Yeub)",인제대학교 디자인연구소,2011,"['지능형 보행 시스템', '시각장애인', 'Smart-Walk System', 'RFID', 'Blinded']"
논문 : 철도시설의 배리어프리 실태조사 및 분석                      = Research Paper : A Study on the Analysis and Investigation about Barrier-Free in Railroad Facilities,노지혜 ( Ji Hye Noh ),한국의료복지건축학회(구 한국의료복지시설학회)(Korea Institute of Healthcare Architecture),2011,"['철도시설', '교통약자', '무장애', '이동성', '접근성', 'railroad facilities', 'the mobility handicapped', 'Barrier-free', 'mobility', 'accessibility']"
중앙분리대를 이용한 도로운영체계 개선방안 연구,이인규,대한교통학회,2011,
교통약자의 대중교통환승을 위한 K경로 알고리즘 적용성 연구                      = Applicability of K-path Algorithm for the Transit Transfer of the Mobility Handicapped,김응철,한국도로학회(Korean Society of Road Engineers),2011,"['교통약자', '통행특성', '환승', 'K경로 알고리즘', '경로삭제방법', 'the mobility handicapped', 'travel characteristic', 'transfer', 'K-path algorithm', 'path deletion method']"
교통약자의 유형별 통행특성 및 통행수단 선택행태 분석에 관한 연구: 경산시를 사례로                      = Analyzing Travel Characteristics and Mode Choice Behavior of the Transportation Handicapped: A Case Study of Gyeongsan City,윤대식,국토연구원(Korea Research Institute for Human Settlements),2010,"['Transportation Handicapped', 'Travel Characteristics', 'Mode Choice', 'Logit Model', '교통약자', '통행특성', '통행수단 선택', '로짓모형']"
시뮬레이션 기법을 이용한 중앙버스전용차로의 정차면수 산정에 관한 연구,김응철,대한교통학회,2010,
생활교통을 위한 교통약자 편의증진방안에 관한 연구 -광주광역시를 중심으로-                      = A Study on Convenience Movement for Living Transportation of Mobility Handicapped,윤판 ( Yoon Pan ),전남대학교 지역개발연구소,2010,"['생활교통', '교통약자', '이동편의', '교통정책', 'Living Traffic', 'Mobility Handicapped', 'Convenience Movement', 'Traffic Policy']"
IPA분석을 이용한 성인지적 관점에서의 지하철 이용자 만족도 분석,박주한,대한교통학회,2010,
인사동길의 교통약자 보행환경 평가                      = 휠체어 이용자의 상점 진입구 접근성을 중심으로,"장민경(Chang, Min-Kyoung)",한국도시설계학회,2010,"['교통약자', '접근성', '인사동 지구단위계획', '인사동', 'Mobility-handicapped', 'Accessibility', 'Insa-dong District Plan', 'Insa-dong']"
교통약자를 위한 모래사장용 액세스보드 디자인에 관한 연구                      = A study of the access board for traffic-vulnerable using at the beach,이창주(Lee chang-Joo),한국디자인학회,2010,"['accessibility', 'traffic-vulnerable', 'universal design']"
교통약자를 배려한 안전스텝 개발에 관한 연구                      = A Study on Development of Safety Step for the Mobility Handicapped,정의진(Euijin Joung),대한전기학회,2010,
교통약자를 중심으로 자전거 시설개선방안에 관한 연구,최병호,대한교통학회,2010,
RFID를 이용한 시각장애인 횡단보도 보행안내 시스템에 관한 연구                      = A Study on Crosswalk Guidance System for the Blind using RFID,박인정(In Jung Park),大韓電子工學會,2010,"['교통약자', '횡단보도', 'RFID Tag', 'RFID Reader', '900㎒']"
교통약자의 이동편익을 위한 영상정보서비스 구현에 관한 연구                      = A Study On Implementation of Imagery information Service for The Mobility Handicapped Persons's Convenience and Safety,김문기(Moongie KIM),대한공간정보학회(The Korean Society for Geo-Spatial Information System),2010,
교통약자 서비스를 위한 정보센터 통합방안                      = Integration of Information Centers for the Elders and Disabled Services,남두희,한국ITS학회,2010,"['Disabled', 'elderly', 'service', 'system integration', 'information center']"
체크리스트를 통한 공항철도의 이용자 시설평가,문서현(Moon Suh-Hyun),대한건축학회(The Architectural Institute of Korea),2010,"['공항철도', '체크리스트', '교통약자의 이동편의 증진법 시행규칙', '이동원활화 기준', 'Airport Railroad', 'Checklist', 'Law to Improve Transportation of Mobility Handicapped People', 'Standards for Efficient Transportation']"
경기도 표준형 택시승강장 개발,오승호(OH Seung-Ho),한국디자인학회,2010,"['public design', 'public facility', 'city identity', 'universal design']"
교통약자의 복지교통 서비스 개선방안                      = Improvement of the Transport Service for the Mobility Handicapped,윤항묵,東義大學校産業技術開發硏究所(Research Institute of Industrial Technology Development Dongeui University),2010,"['mobility handicapped', 'transportation vulnerable', 'transport system', 'disabled']"
차량 내 FM라디오를 이용한 VMS서비스 개선 연구                      = A Study on Enhancing VMS Services by FM Car Radio,박범진,한국ITS학회,2010,"['MS', 'FM', 'watermarking', 'background sound', 'RSSI']"
저상굴절버스의 전 차륜 조향 시스템 ECU 개발에 대한 연구                      = A Study of Development of All Wheel Steering ECU in Bi-modal Tram,김기정,한국정보처리학회,2010,"['전 차륜 조향', '전자제어장치', '회전 반경', '유압시스템', '조향장치', '저상굴절버스']"
바이모달 트램의 저주파 전자계 환경에 대한 연구                      = Research on Electromagnetic Circumstance of Bi-modal Tram in Extremely Low Frequency,송명곤(Myung-Kon Song),대한전기학회,2010,
교통약자를 위한 도시철도 서비스 수준 평가지표 활용 방안                      = Utilization of Urban Rail Service-level Evaluation Index for a Traffic Weak Person,김하나(Ha-Na Kim),한국철도학회,2010,
