교통약자이동지원센터명,소재지도로명주소,소재지지번주소,위도,경도,보유차량대수,보유차량종류,슬로프형휠체어차량대수,리프트형휠체어차량대수,예약접수전화번호,예약접수인터넷주소,앱서비스명,평일예약접수운영시작시각,평일예약접수운영종료시각,주말예약접수운영시작시각,주말예약접수운영종료시각,차량평일운행시작시각,차량평일운행종료시각,차량주말운행시작시각,차량주말운행종료시각,사전예약신청기간,차량이용제한사항,차량관내운행지역,차량관외운행지역,차량이용대상,차량이용요금,관리기관명,관리기관전화번호,데이터기준일자,제공기관코드,제공기관명
시흥시 교통약자이동지원센터(희망네바퀴),,경기도 시흥시 군자동 67-3,37.36380551,126.8067298,32,카니발,32,0,1522-3650,-,-,7:00,21:00,7:00,19:00,7:00,21:00,7:00,19:00,24시간 운영원칙+심야운행시 2일전 사전예약 필수,"다음 제한사항의 각 호에 해당할 경우 동기와 횟수 등을 참작하여 당일 이용제한 및 1개월의 범위 내에서 이용을 제한할 수 있다.+1. 휠체어 1대를 초과하여 승차를 요구할 경우(접었을 경우 2대 가능)+2. 휠체어 이용자 1인을 포함한 4인(비휠체어 이용시 3인) 초과 승차를 요구할 경우+3. 복지카드, 진단서 사본, 진료카드를 제시하지 않는 경우+4. 상담원 및 운전원의 정당한 요구 및 안내에 불응하는 경우+5. 상담원 및 운전원에게 욕설이나",시흥시 전지역,수도권 전지역,"다음 제한사항의 각 호에 해당할 경우 동기와 횟수 등을 참작하여 당일 이용제한 및 1개월의 범위 내에서 이용을 제한할 수 있다.+1. 휠체어 1대를 초과하여 승차를 요구할 경우(접었을 경우 2대 가능)+2. 휠체어 이용자 1인을 포함한 4인(비휠체어 이용시 3인) 초과 승차를 요구할 경우+3. 복지카드, 진단서 사본, 진료카드를 제시하지 않는 경우+4. 상담원 및 운전원의 정당한 요구 및 안내에 불응하는 경우+5. 상담원 및 운전원에게 욕설이나 폭행을 하는 경우+6. 이동지원센터 및 특별교통수단의 기물을 손괴한 경우+7. 특정 차량 및 운전자의 지정을 요구하는 경우+8. 음주 후 이용하는 경우+9. 차량 출발이나 차량 도착 후 이용을 취소한 경우+10. 화물 운송 등의 목적으로 이용하는 경우+11. 이용대상자가 아닌 사람을 부정하게 이용할 수 있도록 돕거나 방치한 경우","기본요금 1,200원(10Km)+ 5Km 초과당 100원 추가+고속도로(유료도로)통행료 및 주차료는 이용자 부담",시흥도시공사,031-488-6910,2021.6.1,4010000,경기도 시흥시
착한수레,경기도 안양시 동안구 평촌대로 389,경기도 안양시 동안구 비산동 1023,37.40629131,126.9487366,38,스타렉스+카니발,38,0,031-389-5200,해당없음,,8:00,18:00,9:00,18:00,6:00,22:00,7:00,20:00,1일전,당일취소 월3회 이상,안양+군포+의왕+과천,수도권전역,심한 장애인으로서 보행상 장애인  장기요양 1~5급(휠체어 등 이용자)  보행상 장애로 인해 휠체어를 이용하는 만65세 이상 노약자 -일시적 장애(깁스 등)  임산부(산모수첩 소지자),"관내 1,200원+관외 1,200원 외 1km당 100원",안양도시공사,031-389-5363,2021.11.12,3830000,경기도 안양시
전남지체장애인협회 영암군지회,전라남도 영암군 영암읍 영암로 1527,전라남도 영암군 영암읍 교동리 50-2,34.79496124,126.6969605,6,승합(중형),6,0,1899-1110,해당없음,,10:00,18:00,10:00,18:00,8:00,18:00,8:00,17:00,전일,,영암군,전라남도+광주,"「장애인복지법 시행규칙」제2조제1항에 따른 장애의 정도가 심한 장애인(「장애인복지법 시행규칙」제28조제1항에 따라 보건복지부장관이 정하는 보행상 장애가 있는 사람에 한한다)으로서 대중교통수단의 이용이 어려운 사람, 65세 이상으로서 대중교통수단의 이용이 어려운 사람임산부으로 대중교통수단의 이용이 어려운 사람일시적으로 휠체어를 이용하는 사람으로서 대중교통수단의 이용이 어려운 사람","기본요금(2Km) : 500원, 거리운임(1km) : 100원, 고속도료, 유료도로, 통행료 및 주차료 : 없음, 콜요금 : 없음, 할증요금 : 없음",전라남도 영암군청,061-470-2356,2021.11.5,4940000,전라남도 영암군
포항시교통약자이동지원센터,경상북도 포항시 남구 희망대로 810 포항종합운동장 167호,경상북도 포항시 남구 대도동 313-1번지 167호,36.008952,129.363876,30,카니발,33,0,1800-9300,http://phhpcall.phsisul.org/,동행콜,7:00,22:00,8:00,20:00,0:00,23:59,8:00,20:00,5일,,포항시,경상북도+대구광역시,장애정도가 심한 장애인으로서 대중교통 이용이 어려운 사람+65세 이상으로 대중교통 이용이 어려운 사람+일시적으로 휠체어를 이용하는 사람으로서 대중교통 이용이 어려운 사람,"관내(포항시내) 기본 5km 1,100원, 추가요금 200원/km, 한도 5,000원+관외(포항시외) 시외버스 요금의 2배(편도기준)+대기료 500원/30분(관외 병원진료 기본대기 2시간 허용)+유료도로비용 및 주차요금은 이용자 부담",포항시시설관리공단,054-280-9601,2021.11.11,5020000,경상북도 포항시
봄내콜이동지원센터,강원도 춘천시 동면 소양강로 304-11(장학리),강원도 춘천시 동면 장학리 464-1,37.91462782,127.7482765,25,카니발+K5,20,0,1544-2014,http://call.gwd.go.kr,강원도 광역 교통약자,9:00,18:00,9:00,18:00,0:00,24:00:00,0:00,24:00:00,병원목적(7일)+개인용무(1일),시설이용자는 환자의 상태에 따라 등록 및 이용제한,춘천시 전지역,강원도+서울+경기도,보행상의 장애인으로서 장애의정도가 심한 장애인+만65세이상 대중교통이용이 어려운 휠체어 이용 노인+일시적 휠체어 사용자,"4km 당 1,100원+1km 당 100원+고속도로(유료도료)통행료는 이용자부담(기초생활수급자는 면제)",강원도 춘천시청,033-250-4299,2020.12.16,4180000,강원도 춘천시
울릉택시협동조합,경상북도 울릉군 울릉읍 봉래길 250,,37.49693638,130.8971107,1,소렌토,1,0,054-791-2315,-,-,9:00,22:00,9:00,22:00,9:00,22:00,9:00,22:00,1일~7일전,주말사전예약필수,-,-,"장애인복지법 시행규칙 제2조제1항에 따른 장애인 1급 또는 2급 장애인으로서 대중교통의 이용이 어려운 사람, 일시적으로 휠체어를 이용하는 사람으로서 대중교통의 이용이 어려운 사람, 65세 이상으로 대중교통의 이용이 어려운 t람, 임산부로서 대중교통의 이용이 어려운 사람, 해당하는 교통약자를 동반하는 가족 및 보호자, 그 밖에 특별교통수단이 필요하다고 군수가 인정하는 사람",200,울릉군,054-790-6254,2020.12.31,5260000,경상북도 울릉군
광명시 교통약자이동지원센터,경기도 광명시 범안로 966,경기도 광명시 하안동 314번지,37.45727525,126.8723345,27,스타렉스 개조차+카니발 개조차,24,2,02-2610-2000,http://kmcar.gmuc.co.kr,,7:00,22:00,7:00,13:00,0:00,24:00:00,0:00,24:00:00,휠체어 이용고객 1일전비휠체어 당일예약,,광명시 전지역,구로구+금천구+양천구+영등포구+안양 관공서+시흥 관공서+안산 관공서+인천공항+김포공항+서울대형병원 16곳+부천 병원+안양 병원+ 시흥 병원+센터 반경 20km 이내 특수학교 및 대학교,"장애1,2급(뇌병변, 지적장애 3급)+장기요양등급 1~3급+일시적인 교통약자","관내지역 1,250원",광명도시공사,02-2610-2000,2020.12.14,3900000,경기도 광명시
오산시교통약자이동지원센터,경기도 오산시 경기동로 15,경기도 오산시 오산동 49,37.156843,127.0726163,17,그랜드 카니발+그랜드 스타렉스+모닝+올뉴카니발+더뉴카니발,15,0,031-378-7816,해당사항없음,해당사항없음,9:00,18:00,8:00,20:00,0:00,24:00:00,8:00,20:00,7일,예약시간 1시간 이내의 취소 변경(장소 및 시간)+예약시간부터 10분 이내 미탑승+차량동승 신청을 하지 않고 예약자 본인 외에 다른 사람과 차량을 탑승하는 경우+이용 신청일 현재 미납요금이 있는 경우+센터에 연락하지 않고 운전원에게 직접 연락하고 차량을 이용하는 경우(즉시 이용제한)+기타 차량 운행에 방해를 주는 경우(즉시 이용 제한)+상담원에게 성적 수치심을 줄수 있는 농담 인격모독 욕설을 하는 경우(즉시 이용 제한),오산시,서울시+경기도+인천공항,장애정도가 심한 장애에 해당하는 사람으로서 <보행상 장애 표준기준표>에 해당하는 사람+국가유공자 상이등급 3급 이상에 해당하는 사람+장기요양보험 수급자(1~3급)+대중교통이용이 어렵다는 진단서를 제출한 사람(상기 대상자를 제외한 장애인 또는 국가유공자+65세 이상+임산부+일시적으로 휠체어를 이용하거나 재활치료를 받는 사람),"관내: 1,300원+관외: 1,300원 + 1km당 100원씩 할증(유료도로 통행료+톨게이트 비용+유료주차장요금 등 현장에서 발생하는 비용은 고객부담)",경기도 오산시,031-8036-7717,2021.7.1,4000000,경기도 오산시
동두천시 교통약자(특별교통수단) 이동지원센터(동두천모범운전자회),경기도 동두천시 어등로58,경기도 동두천시 생연동 70-2,37.89864229,127.0691004,14,카니발+스타렉스+봉고3,12,2,031-862-1091,없음,,8:00,18:00,8:00,18:00,0:00,24:00:00,7:00,22:00,7일,,동두천시 전지역,수도권 전지역(병원진료 우선),「장애인복지법 시행규칙」 제28조제1항에 따른 보행상의 장애인으로서 같은 규칙 별표 1에 따른 장애의 정도가 심한 장애인으로서 버스ㆍ지하철 등의 이용이 어려운 사람+만65세 이상으로 대중교통의 이용이 어려운 자+임산부로서 대중교통의 이용이 어려운 자+일시적으로 휠체어를 이용하는 자로서 대중교통수단의 이용이 어려운 자+제1호부터 제4호까지의 규정에 해당하는 교통약자를 동반하는 가족 및 보호자,관내 (1000원/회)+관외(1km당/100원),동두천시청 교통행정과,031-860-2290,2021.6.30,3920000,경기도 동두천시
전남지체장애인협회담양군지회,전라남도 담양군 담양읍 천변5길 63,,35.31476994,126.9766124,3,창림저상슬로프장애인차,3,0,061-381-3100,http://kappd-jn.or.kr,,9:00,18:00,9:00,18:00,9:00,18:00,9:00,18:00,7일,,,,1~2급+휠체어 이용자,관내지역 (2km까지) 기본요금 1400원,전라남도 담양군청,061-380-3055,2021.6.29,4850000,전라남도 담양군
강남세움복지관,서울특별시 강남구 광평로60길 22,서울특별시 강남구 수서동 721,37.48698084,127.106927,3,대형승합차,0,3,02-2184-8707,www.gnseum.org,해당사항 없음,9:00,18:00,0:00,23:59,7:30,17:21,0:00,23:59,해당사항 없음,해당사항 없음,강남구 관내,해당사항 없음,장애인+노약자+임산부,0,서울특별시 강남구청,02-3423-5874,2022.3.25,3220000,서울특별시 강남구
파주시 교통약자이동지원센터,경기도 파주시 월롱면 휴암로11,경기도 파주시 위전리 598-4,37.7961277,126.7901986,36,승합(중형)+카니발 저상장애인차+다인승버스,35,1,080-699-6199,https://ggsts.gg.go.kr/front/index.do,,0:00,23:59,0:00,23:59,0:00,23:59,0:00,23:59,0일,"월 3회 이상 배차 후 취소한 경우+동승자 및 보호자 탑승인원 초과한 경우+콜센터를 통하지 않고 운전원에게 직접 연락하여 차량을 이용한 경우+직원에게 폭언 및 폭행한 경우+월 3회 이상 보호가 필요한 이용자임에도 보호자없이 탑승한 경우 +요금을 체납한 경우+청결하지 않은 물품이나 폭발성인화성 물질+캐리어 외 동물(장애인 보조견, 전용 운반상자에 넣은 애완동물은 제외) 소지하여 탑승한 경우",관내 전지역,서울+경기+인천,장애의 정도가 심한 장애인+만 65세이상으로 대중교통 이용이 어려운 사람+임산부+일시적으로 휠체어를 이용하는 사람으로서 대중교통 이용이 어려운 사람,관내: 1250원 정액제+관외: 기본요금(1250원)+5km당 100원 추가,파주도시관광공사,031-909-6341,2022.4.29,4060000,경기도 파주시
양주시교통약자이동지원센터,경기도 양주시 광적면 부흥로618번길 303,경기도 양주시 광적면 광석리 132,37.81249951,126.9723084,23,스타렉스+카니발,23,0,031-861-9977,해당없음,양주시 교통약자 스마트앱,9:00,18:00,0:00,0:00,7:00,23:00,8:00,21:00,이용예정일 2일전부터,,관내 전지역,공항+경기북부+서울(병원진료시)+도봉산역 환승센터+수락산역+구파발역,장애의 정도가 심한 장애인 중 보행상 장애인+65세 이상 대중교통 이용이 어려운 사람(진단서)+임산부(산모수첩) 등,(기본요금) 10Km이내 1200원+(거리요금)기본요금 외 10Km 초과 시 5Km마다 100원 추가+유료도로 및 주차요금 이용자 부담,경기도 양주시청 대중교통과,031-8082-6602,2022.4.21,5590000,경기도 양주시
단양군장애인생활이동지원센터,충청북도 단양군 단양읍 별곡5길5 (3층),충청북도 단양군 단양읍 별곡리 319,36.98530043,128.3686533,2,스타렉스2대,0,0,043-421-7788,해당없음,,9:00,18:00,0:00,0:00,9:00,18:00,0:00,0:00,3일 전,복지카드 미소지자+등록 장애인이 아닌 경우+본인 포함 3명까지 탑승 가능,단양군 전체,전지역,등록장애인,(관내 기본거리)10km 1500원+(관내10km초과 시)10km 당 1500원+(관외 기본거리 30km)4500원+(관외 30km 초과)1km당 600원,충청북도 단양군청,043-420-2133,2022.4.8,4480000,충청북도 단양군
단양군장애인단체연합회,충청북도 단양군 단양읍 별곡5길5 (3층),충청북도 단양군 단양읍 별곡리 319,36.98530043,128.3686533,1,스타렉스,0,1,043-423-1776,해당없음,,9:00,18:00,0:00,0:00,9:00,18:00,0:00,0:00,시내 1일전+시외 1주일 전,복지카드미소지자+출발도착지 단양군아닌경우+장애인이 아닌경우+2회 요금미납자,단양군 전체,전지역,단양군내 거주하는 등록장애인,"(관내 기본거리 10km)1500원+(관내10km초과 시)10km 당 1500원+(관외 기본거리 30km)4500원,+(관외30km 초과 시)1km당 600원+(1일 임대 8시간)90000원+대기료(40분 무료, 20분당 1500원)+주차 이용자부담+톨비 이용자부담",충청북도 단양군청,043-420-2134,2022.4.8,4480000,충청북도 단양군
군포시 교통약자 이동지원센터,경기도 군포시 공단로 30,경기도 군포시 금정동 689-59,37.34847646,126.9503025,23,그랜드카니발,23,0,1899-4428,https://bokjicall.gunpouc.or.kr,군포시 교통약자 이동지원센터,6:00,22:00,0:00,0:00,0:00,23:59,0:00,23:59,2일전,복지카드(신분증)등 증빙서의 제시 또는 관련 서류의 제출을 거부한 경우실제 탑승인과 복지카드(신분증) 및 증빙서의 이용 대상자가 다를 경우보호자 없이 탑승 시 안전상의 문제가 발생할 수 있다고 판단되는 경우기타 이에 준하는 상황이 발생하여 운행할 수 없다고 판단하는 경우,안양+의왕,서울+경기+인천,장애인 : 장애정도가 심한 장애인+고령자 : 노인장기요양 전체 등급으로 노인장기요양인정서를 소지하며 대중교통이용이 어려운 시민+임산부 : 산모수첩을 소지한 임산부 또는 출산 후 6개월까지 시민,10km 1200원,군포도시공사,1899-4428,2022.4.21,4020000,경기도 군포시
고창군교통약자이동지원센터,전라북도 고창군 고창읍 월곡14길 19,전라북도 고창군 고창읍 월곡리 620,35.43762073,126.7129638,6,카니발+스타렉스,5,1,063-561-2338,0632270002.com,전라북도 광역이동지원센터,0:00,0:00,0:00,0:00,6:00,22:00,8:00,18:00,1일전,,전지역,전라북도,장애의정도가 심한 장애인 중 대중교통 이용이 어려운 자(보행상 장애인),일반택시요금의 50,고창군청,063-560-2573,2020.11.30,4780000,전라북도 고창군
교통편의관리소,경상남도 창원시 성산구 원이대로 450,경상남도 창원시 성산구 중앙동 1,35.23400713,128.6647354,107,"스타렉스100대, 카니발 7대",83,24,1566-4488,-,,0:00,0:00,0:00,0:00,0:00,0:00,0:00,0:00,1,"당일 즉시 이용자 또는 예약자로서 차량 도착 후 이용 취소차량 도착 후 30분 이내에 승차하지 않은 경우가 3회 이상예약시간으로부터 1시간 이내 예약 취소가 3회 이상이용신청 없이 운전원과 직접 연락하여 치량을 이용무임승차가 2회 이상인 경우교통약자와 동반할 목적이 아닌 일반인의 동승 및 중도 하차 요구치료 목적 이외에 사적인 용무로 경상남도를 벗어난 자상담원, 운전원에 대한 욕설, 폭언,폭행, 성적 희롱 2회 이상의도적으로 특별교통수단 운행을",창원 전역,"밀양시,김해시,진주시통영시,사천시,거제시양산시,창녕군,의령군함안군,고성군,남해군하동군,산청군,함양군거창군,합천군,김해공항부산광역시","창원시를 방문한 교통약자(출발이나 도착하는 곳이 창원시인 경우)장애1급,2급65세이상,임산부(대중교통 이용이 어렵다는 의사소견서 지참 시 이용가능)일시적 휠체어 이용자","기초수급자(1,000원 정액제)시내구간 이용요금(1,500원 정액제-시내버스요금 인상 시 연동 적용)시외구간 이용요금밀양시(6,900원), 김해시(3,800원), 진주시(5,900원), 통영시(9.900원), 사천시(6,300원), 거제시(13,700원), 양산시(5,100원), 창녕군(4,400원), 의령군(4,600원), 함안군(2,700원), 고성군(7,600원), 남해군(11,000원), 하동군(11,800원), 산청군(10,600원), 함양군(13,700원), 거창군(15,000원), 합천군(10,300원), 김해공항(5,400원), 부산광역시(6,700원)",창원시,055-225-4314,2020.12.2,B553892,창원시설공단
태안군 교통약자 이동지원센터,충청남도 태안군 태안읍 후곡로 83,,36.74591186,126.3018915,2,카니발,2,1,041-673-1040,N,N,9:00,17:20,0:00,0:00,9:00,17:50,0:00,0:00,15일,중증환자,서산시+태안군,태안군 외 지역,중증장애 1~2급+영유아+노약자,"기본요금 1.5km 1,000원+거리요금(140m당) 50원+시간요금(3초) 50원+관외(4시간) 40,000원+관외(8시간) 80,000원",태안군,041-670-2808,2020.12.1,4620000,충청남도 태안군
전남지체장애인협회 화순군지회,전라남도 화순군 화순읍 부처샘길 5-11,,35.0677473,126.991519,3,카니발,3,0,1899-1110,https://hwasun.go.kr,,8:00,19:00,8:00,17:00,8:00,19:00,8:00,17:00,연중,없음,관내 전읍면,광주광역시+ 나주시,1~2급 지체장애인+1~5급시각장애인,기본요금 500원,전라남도 화순군,061-379-3784,2020.12.18,4900000,전라남도 화순군
영양군교통약자이동지원센터　,경상북도 영양군 영양읍 동서대로 90 (종합복지회관 3층),,36.66192436,129.1186857,3,스타렉스+카니발,3,0,1899-7770,http://www.brmcall.co.kr,,0:00,0:00,0:00,0:00,7:00,18:00,9:00,18:00,5일　,사항 등을 참작하여 3개월 내에서 이용을 제한,영양군 전지역,경상북도+대구광역시,심한 장애인 및 65세이상노약자(의사소견첨부) 회원등록자+교통약자를 동반하는 가족 및 보호자(2명내),관내(시내버스요금)+관외(시외버스요금)+고속도로(유료도로)통행료는 이용자 부담(왕복통행료),영양군,054-680-6740,2020.11.12,5170000,경상북도 영양군
아산시 특별교통수단이동지원센터,"충청남도 아산시 시민로457번길 31, 동우빌딩 2층",충청남도 아산시 온천동 1411,36.7887274,126.998424,25,승합,21,4,1644-5588,해당없음,해당없음,7:00,23:59,7:00,21:00,7:00,23:59,7:00,21:00,관내 불가 / 관외 최대 2일 전,"장애인(3급 하지장애 외, 4급~), 65세이상 대중교통이용 가능한자",아산시 전역,충청남도 전역,"- 1·2급 장애인, 뇌병변·지체 3급 장애인 중 대중교통 이용이 불편한 자 - 만65세 이상 고령자 중 대중교통 이용이 불편한자-  임산부,일시적 교통약자(대중교통 이용이 불편한자)","기본요금 700원(2km까지), 추가요금 130원(1km당) / 관외 260원(1km) / 관외 대기 30분당 2,000원",아산장애인단체연합회,041-540-1506,2020.11.3,4520000,충청남도 아산시
교통약자이동지원센터,전라북도 부안군 부안읍 오리정로 89,전라북도 부안군 부안읍 서외리 536-15,35.7233599,126.7317745,5,카니발,5,0,063-583-1010,없음,없음,8:00,18:00,0:00,0:00,8:00,22:00,9:00,18:00,하루전까지,,관내(부안군),전국,1급 또는 2급+65세이상+국가유공상이자+일시적휠체어,거리요금 148m당 30원,부안군청,063-580-4539,2021.6.21,4790000,전라북도 부안군
장애인콜택시,전라북도 완주군 봉동읍 봉동동서로 89,전라북도 완주군 봉동읍 장기리 285-5,35.93733633,127.1620975,10,스타렉스+카니발,10,0,063-227-0002,http://0632270002.com,,9:00,18:00,9:00,18:00,0:00,0:00,8:00,20:00,7일전부터 전일 17시까지,무단취소3회이상+음주자+폭언+폭행+기타운전방해자,완주군전지역,전북도내 및 전국,"장애의정도가 심한 장애인 중 보행상 장애인, 65세 이상으로 대중교통 이용이 어려운 자, 임산부 및 일시적 휠체어 사용자","기본2km까지1400원, 권역 내 최대 2,000원 요금상한제 적용",완주군청,063-290-2803,2021.6.18,4720000,전라북도 완주군
천안시 교통약자이동지원센터,충청남도 천안시 동남구 다가말2길 104,충청남도 천안시 동남구 다가동 405-6,36.7979991,127.1431034,31,카니발+스타렉스,31,0,1644-5588,없음,없음,0:00,23:59,0:00,23:59,0:00,23:59,0:00,23:59,2일전,"1. 이용고객의 차량을 예약하고 비장애인만 승차 시키는 경우2. 장애등급을 허위 고지하여 우선배차를 받는 등 부정 탑승 행위를 한 경우 3. 운전에 방해를 줄 수 있는 고객 탑승 시 보호자가 동승하지 않는 경우4. 교통약자를 위한 보호자의 동반 탑승은 최초 탑승 시부터 최종 목적지까지 같이 동승하여 타고 내려야 하며, 중도에 보호자만 개별적으로 타고 내리는 경우5. 장애인 보조견을 제외한 운전에 방해를 줄 수 있는 애완동물 및 폭발성, 인화성 ",천안시,충청남도,"교통약자법 시행규칙 제6조에 해당되는 사람, 임신부, 일시적장애인","관내 기본요금 1000원(2km), km당 130원",충남지체장애인협회 천안시지부,041-558-0010,2021.6.16,6440000,충청남도
공주시 교통약자이동지원센터,"충청남도 공주시 의당면 의당로 257, 장애인복지센터 203호",충청남도 공주시 의당면 청룡리 903,36.49366156,127.1356957,10,카니발+스타렉스,10,0,1644-5588,없음,없음,0:00,23:59,0:00,23:59,9:00,16:00,9:00,15:00,2일전,없음,공주시,충청남도,교통약자법 시행규칙 제6조에 해당되는 사람,"관내 기본요금 1000원(2km), km당 130원",충남지체장애인협회 공주시지부,041-852-5858,2021.6.16,6440000,충청남도
보령시 교통약자이동지원센터,"충청남도 보령시 주공로8, 대동빌딩 3층 2호",충청남도 보령시 명천동 1037,36.34544473,126.6020154,9,카니발,6,3,1644-5588,없음,없음,0:00,23:59,0:00,23:59,7:00,21:00,9:00,16:00,2일전,없음,보령시,충청남도,"교통약자법 시행규칙 제6조에 해당되는 사람, 일시적장애인","관내 기본요금 1400원(2km), km당 130원",충남지체장애인협회 보령시지부,041-933-3517,2021.6.16,6440000,충청남도
아산시 교통약자이동지원센터,충청남도 아산시 시민로457번길 30 (2층),충청남도 아산시 온천동 1411,36.78898932,126.9978278,20,카니발+스타렉스,16,4,1644-5588,없음,없음,0:00,23:59,0:00,23:59,7:00,23:59,7:00,21:00,2일전,"장애인(3급 하지장애 외, 4급~), 65세이상 대중교통이용 가능한자",아산시,충청남도,"교통약자법 시행규칙 제6조에 해당되는 사람, 임신부, 일시적장애인","관내 기본요금 700원(2km), km당 130원",아산시장애인연합회,041-546-1509,2021.6.16,6440000,충청남도
대광택시㈜,경상남도 밀양시 부북면 밀양대로 1651,,35.47395045,128.7540292,20,승합차,20,0,1566-4488,해당없음,,0:00,23:59,0:00,23:59,0:00,23:59,0:00,23:59,N,회원제 운영 예정,밀양시 관내 일원,경상남도,회원 가입자,https://www.miryang.go.kr/web/index.do?mnNo=50306000000,㈜대광택시,055-356-3962,2021.11.5,5360000,경상남도 밀양시
서산시 교통약자이동지원센터,충청남도 서산시 오산1길 11 (2층),충청남도 서산시 오남동 16-5,36.74512191,126.4852735,8,카니발+스타렉스,8,0,1644-5588,없음,없음,0:00,23:59,0:00,23:59,9:00,16:00,9:00,13:00,2일전,,서산시,충청남도,"교통약자법 시행규칙 제7조에 해당되는 사람, 임신부, 일시적장애인","관내 기본요금 1400원(2km), km당 130원",충남지체장애인협회 서산시지부,041-665-1111,2021.6.16,6440000,충청남도
